{
  "$schema": "https://json-schema.org/draft/2020-12/schema",
  "$id": "https://dionysus/schemas/seed-route-map.schema.json",
  "title": "Dionysus seed route map",
  "type": "object",
  "additionalProperties": false,
  "required": [
    "schema_version",
    "schema_ref",
    "owner_repo",
    "surface_kind",
    "authority_ref",
    "artifact_identity",
    "next_live_seed_ref",
    "validation_refs",
    "routes"
  ],
  "properties": {
    "schema_version": {
      "const": "dionysus_seed_route_map_v2"
    },
    "schema_ref": {
      "const": "schemas/seed-route-map.schema.json"
    },
    "owner_repo": {
      "const": "Dionysus"
    },
    "surface_kind": {
      "const": "seed"
    },
    "authority_ref": {
      "type": "string",
      "const": "docs/codex/planting-protocol.md"
    },
    "artifact_identity": {
      "$ref": "#/$defs/artifact_identity"
    },
    "next_live_seed_ref": {
      "type": "string",
      "minLength": 1
    },
    "validation_refs": {
      "type": "array",
      "minItems": 1,
      "items": {
        "type": "string",
        "minLength": 1
      }
    },
    "routes": {
      "type": "array",
      "minItems": 3,
      "maxItems": 3,
      "items": {
        "$ref": "#/$defs/route"
      }
    }
  },
  "$defs": {
    "artifact_identity": {
      "type": "object",
      "additionalProperties": false,
      "required": [
        "artifact_class",
        "surface_state",
        "owner_repo",
        "authority_ref",
        "producer",
        "consumer_expectation",
        "privacy_boundary",
        "content_identity",
        "abi_epoch",
        "contract_version",
        "trust_layer",
        "verification",
        "action"
      ],
      "properties": {
        "artifact_class": {
          "type": "string",
          "minLength": 3
        },
        "surface_state": {
          "type": "string",
          "minLength": 3
        },
        "owner_repo": {
          "type": "string",
          "const": "Dionysus"
        },
        "authority_ref": {
          "type": "string",
          "const": "docs/codex/planting-protocol.md"
        },
        "producer": {
          "type": "string",
          "minLength": 3
        },
        "consumer_expectation": {
          "type": "string",
          "minLength": 3
        },
        "privacy_boundary": {
          "type": "string",
          "minLength": 3
        },
        "content_identity": {
          "type": "string",
          "minLength": 3
        },
        "abi_epoch": {
          "type": "string",
          "const": "dionysus_seed_route_map_v2"
        },
        "contract_version": {
          "type": "string",
          "minLength": 3
        },
        "trust_layer": {
          "type": "array",
          "minItems": 1,
          "items": {
            "type": "string",
            "minLength": 3
          }
        },
        "verification": {
          "type": "array",
          "minItems": 1,
          "items": {
            "type": "string",
            "minLength": 3
          }
        },
        "action": {
          "type": "string",
          "minLength": 3
        }
      }
    },
    "route": {
      "type": "object",
      "additionalProperties": false,
      "required": [
        "route_id",
        "need",
        "surface_ref",
        "verification_refs"
      ],
      "properties": {
        "route_id": {
          "type": "string",
          "minLength": 1
        },
        "need": {
          "type": "string",
          "minLength": 1
        },
        "surface_ref": {
          "type": "string",
          "minLength": 1
        },
        "verification_refs": {
          "type": "array",
          "minItems": 1,
          "items": {
            "type": "string",
            "minLength": 1
          }
        }
      }
    }
  }
}
