{"schema_version":"dionysus_seed_route_map_v2","schema_ref":"schemas/seed-route-map.schema.json","owner_repo":"Dionysus","surface_kind":"seed","authority_ref":"docs/codex/planting-protocol.md","artifact_identity":{"artifact_class":"dionysus_seed_route_readmodel_bundle","surface_state":"public_source_generated_seed_route_capsule","owner_repo":"Dionysus","authority_ref":"docs/codex/planting-protocol.md","producer":"scripts/build_seed_route_map.py via scripts/seed_route_map_common.py from seed-registry.yaml and route specs","consumer_expectation":"Verify schema_version, owner_repo, surface_kind, authority_ref, artifact_identity, next_live_seed_ref, route refs, build_seed_route_map --check, validate_seed_route_map, and seed-surface validation before using this as low-context seed navigation; do not treat it as seed canon or owner-repo landing proof.","privacy_boundary":"Public seed navigation and source refs only; no private operator traces, secrets, live runtime state, machine-local state, session transcripts, or unpublished owner-repo evidence.","content_identity":"generated/seed_route_map.min.json rendered from build_payload() and compared by build_seed_route_map --check plus validate_seed_route_map.","abi_epoch":"dionysus_seed_route_map_v2","contract_version":"repo:abyss-machine/manifests/artifact_signature_policy.manifest.json@0.2.4#dionysus_seed_route_readmodel_bundle","trust_layer":["abi_contract_signature","w3c_prov_lineage"],"verification":["scripts/build_seed_route_map.py","scripts/validate_seed_route_map.py","scripts/validate_abyss_machine_seed_route_bundle.py","scripts/validate_seed_surfaces.py","scripts/validate_seed_registry.py","tests/test_seed_route_map.py"],"action":"ADD_CONSUMER_EXPECTATION"},"validation_refs":["scripts/build_seed_route_map.py","scripts/validate_seed_route_map.py","scripts/validate_abyss_machine_seed_route_bundle.py","scripts/validate_seed_surfaces.py","scripts/validate_seed_registry.py","tests/test_seed_route_map.py"],"next_live_seed_ref":"seed_expansion/seed.tos.wider-world-thought-expansion.v0.md#tos-expansion-wider-world-thought-expansion","routes":[{"route_id":"next-live-seed","need":"locate the current gated live seed before opening staging or owner-repo follow-through","surface_ref":"seed_expansion/seed.tos.wider-world-thought-expansion.v0.md#tos-expansion-wider-world-thought-expansion","verification_refs":["seed-registry.yaml","docs/codex/planting-protocol.md"]},{"route_id":"registry-validation","need":"validate registry and seed-surface coherence before trusting a seed route","surface_ref":"seed-registry.yaml","verification_refs":["schema/seed-registry.contract.yaml","docs/codex/planting-protocol.md"]},{"route_id":"questbook-follow-through","need":"inspect seed-garden quest follow-through without mistaking it for owner sovereignty","surface_ref":"generated/quest_catalog.min.json","verification_refs":["generated/quest_dispatch.min.json","QUESTBOOK.md"]}]}
